{
  "artifact_id": "acceptance-641b103b4f2637f13820",
  "backup_restore": "PASS",
  "created_at": "2026-07-26T16:15:55Z",
  "evidence_refs": [
    "evidence/package-validation-report.json",
    "docs/IMPLEMENTATION-LEDGER.md"
  ],
  "host": {
    "admin_publicly_exposed": false,
    "os": "Windows-10-10.0.19044-SP0",
    "service_user": "hermesfactory"
  },
  "mandatory_scenarios": [
    {
      "evidence_ref": "evidence/package-validation-report.json",
      "id": "local-1",
      "status": "PASS"
    },
    {
      "evidence_ref": "evidence/package-validation-report.json",
      "id": "local-2",
      "status": "PASS"
    },
    {
      "evidence_ref": "evidence/package-validation-report.json",
      "id": "local-3",
      "status": "PASS"
    },
    {
      "evidence_ref": "evidence/package-validation-report.json",
      "id": "local-4",
      "status": "PASS"
    },
    {
      "evidence_ref": "evidence/package-validation-report.json",
      "id": "local-5",
      "status": "PASS"
    },
    {
      "evidence_ref": "evidence/package-validation-report.json",
      "id": "local-6",
      "status": "PASS"
    },
    {
      "evidence_ref": "docs/IMPLEMENTATION-LEDGER.md",
      "id": "vps-bootstrap",
      "status": "BLOCKED_EXTERNAL"
    },
    {
      "evidence_ref": "docs/IMPLEMENTATION-LEDGER.md",
      "id": "hermes-compatibility",
      "status": "BLOCKED_EXTERNAL"
    },
    {
      "evidence_ref": "docs/IMPLEMENTATION-LEDGER.md",
      "id": "credentials",
      "status": "BLOCKED_EXTERNAL"
    },
    {
      "evidence_ref": "docs/IMPLEMENTATION-LEDGER.md",
      "id": "github-governance",
      "status": "BLOCKED_EXTERNAL"
    },
    {
      "evidence_ref": "docs/IMPLEMENTATION-LEDGER.md",
      "id": "telegram-gateway",
      "status": "BLOCKED_EXTERNAL"
    },
    {
      "evidence_ref": "docs/IMPLEMENTATION-LEDGER.md",
      "id": "pilot-e2e",
      "status": "BLOCKED_EXTERNAL"
    },
    {
      "evidence_ref": "docs/IMPLEMENTATION-LEDGER.md",
      "id": "offsite-backup",
      "status": "BLOCKED_EXTERNAL"
    }
  ],
  "open_items": [
    "vps-bootstrap",
    "hermes-compatibility",
    "credentials",
    "github-governance",
    "telegram-gateway",
    "pilot-e2e",
    "offsite-backup"
  ],
  "pilot": {
    "acceptance": "FAIL",
    "release": "not-deployed",
    "repository": "brullik/hermes-factory-pilot",
    "url": null
  },
  "policy_digest": "4f53cda18c2baa0c0354bb5f9a3ecbe5ed12ab4d8e11ba873c2f11161202b945",
  "producer": {
    "model": null,
    "provider": null,
    "role": "acceptance",
    "tier": "deterministic"
  },
  "product_id": "hermes-software-factory",
  "resource_usage": {
    "disk_cleanup": "PASS",
    "max_workers": 2,
    "oom_events": 0
  },
  "schema_version": "1.0",
  "security": "PASS",
  "status": "BLOCKED_EXTERNAL",
  "summary": "Local deterministic checks passed; VPS/provider/GitHub/Telegram acceptance is blocked until external access is connected.",
  "versions": [
    {
      "component": "python",
      "digest": "456202baf8dc591c9709af663425c3d5a6607453acc29ac1324333c7a494a705",
      "version": "3.14.0"
    },
    {
      "component": "package",
      "digest": "c28fcca53637bc88e124af1725df13cb98c69dedefd62fb3cdbe1cdb6b760624",
      "version": "2.0.0"
    }
  ]
}
